{
  "contract_version": "0.2.0",
  "fx_policy": {
    "policy_version": "fx-v0.1",
    "target_currency": "USD",
    "target_scale": 6,
    "rounding_mode": "half_even",
    "rates": [
      {
        "currency": "USD",
        "rate_unscaled": "100000000",
        "rate_scale": 8,
        "source": "synthetic-fixture-rate",
        "as_of": "2026-08-12T00:00:00.000Z"
      }
    ]
  },
  "metric_evaluations": [],
  "reconciliation_inputs": [],
  "privacy_requests": [],
  "server_context": {
    "tenant_id": "tenant-a",
    "app_id": "app-a",
    "received_at": "2026-08-12T00:00:00.000Z",
    "policy_digest": "policy-v0.1",
    "processing_purposes": [
      {
        "processing_purpose_id": "analytics",
        "consent_required": false,
        "policy_version": "consent-v0.1"
      }
    ],
    "withdrawals": [],
    "alternative_legal_bases": []
  },
  "records": [
    {
      "contract_version": "0.2.0",
      "record_id": "dup-first",
      "delivery_id": "delivery:dup-first",
      "tenant_id": "tenant-a",
      "app_id": "app-a",
      "producer": "redirector",
      "producer_version": "fixture-v0.1",
      "event_id": "event:dup-first",
      "event_name": "click",
      "schema_version": "0.2.0",
      "occurred_at": "2026-08-10T00:00:00.000Z",
      "occurred_at_source": "server",
      "received_at": "2026-08-12T00:00:00.000Z",
      "processing_purpose_id": "analytics",
      "processing_sequence": 1,
      "payload": {
        "click_id": "click-a",
        "tracking_link_id": "link-a",
        "campaign_id": "campaign-a",
        "redirector_click_at": "2026-08-10T00:00:00.000Z",
        "redirector_time_status": "available"
      }
    },
    {
      "contract_version": "0.2.0",
      "record_id": "dup-second",
      "delivery_id": "delivery:dup-second",
      "tenant_id": "tenant-a",
      "app_id": "app-a",
      "producer": "redirector",
      "producer_version": "fixture-v0.1",
      "event_id": "event:dup-first",
      "event_name": "click",
      "schema_version": "0.2.0",
      "occurred_at": "2026-08-10T00:00:00.000Z",
      "occurred_at_source": "server",
      "received_at": "2026-08-12T00:00:00.000Z",
      "processing_purpose_id": "analytics",
      "processing_sequence": 1,
      "payload": {
        "click_id": "click-a",
        "tracking_link_id": "link-a",
        "campaign_id": "campaign-a",
        "redirector_click_at": "2026-08-10T00:00:00.000Z",
        "redirector_time_status": "available"
      }
    }
  ]
}
