{
  "contract_version": "0.2.0",
  "fx_policy": {
    "policy_version": "fx-v0.1",
    "target_currency": "USD",
    "target_scale": 6,
    "rounding_mode": "half_even",
    "rates": [
      {
        "currency": "EUR",
        "rate_unscaled": "125000000",
        "rate_scale": 8,
        "source": "synthetic-fixture-rate",
        "as_of": "2026-08-12T00:00:00.000Z"
      }
    ]
  },
  "metric_evaluations": [
    {
      "metric_run_id_prefix": "run-08-initial",
      "input_received_at_watermark": "2026-08-12T23:59:59.999Z",
      "computed_at": "2026-08-13T00:00:00.000Z",
      "data_freshness": "late_excluded",
      "privacy_state": "before"
    },
    {
      "metric_run_id_prefix": "run-08-recalculated",
      "input_received_at_watermark": "2026-08-13T00:00:00.000Z",
      "computed_at": "2026-08-13T00:01:00.000Z",
      "data_freshness": "recalculated",
      "privacy_state": "before",
      "supersedes_metric_run_id_prefix": "run-08-initial"
    }
  ],
  "reconciliation_inputs": [],
  "privacy_requests": [],
  "server_context": {
    "tenant_id": "tenant-a",
    "app_id": "app-a",
    "received_at": "2026-08-12T00:00:00.000Z",
    "policy_digest": "policy-v0.1",
    "processing_purposes": [
      {
        "processing_purpose_id": "analytics",
        "consent_required": false,
        "policy_version": "consent-v0.1"
      }
    ],
    "withdrawals": [],
    "alternative_legal_bases": []
  },
  "records": [
    {
      "contract_version": "0.2.0",
      "record_id": "install-8",
      "delivery_id": "delivery:install-8",
      "tenant_id": "tenant-a",
      "app_id": "app-a",
      "producer": "sdk-android",
      "producer_version": "fixture-v0.1",
      "event_id": "event:install-8",
      "event_name": "install",
      "schema_version": "0.2.0",
      "occurred_at": "2026-08-12T00:00:00.000Z",
      "occurred_at_source": "device",
      "received_at": "2026-08-12T00:01:00.000Z",
      "processing_purpose_id": "analytics",
      "processing_sequence": 1,
      "payload": {
        "installation_id": "installation:install-8",
        "install_type": "first_install",
        "referrer_status": "none",
        "click_id": "click-a_0000000000000000",
        "install_begin_at_server_status": "missing"
      }
    },
    {
      "contract_version": "0.2.0",
      "record_id": "revenue-late",
      "delivery_id": "delivery:revenue-late",
      "tenant_id": "tenant-a",
      "app_id": "app-a",
      "producer": "sdk-android",
      "producer_version": "fixture-v0.1",
      "event_id": "event:revenue-late",
      "event_name": "ad_revenue",
      "schema_version": "0.2.0",
      "occurred_at": "2026-08-12T12:00:00.000Z",
      "occurred_at_source": "device",
      "received_at": "2026-08-13T00:00:00.000Z",
      "processing_purpose_id": "analytics",
      "processing_sequence": 1,
      "payload": {
        "installation_id": "installation:install-8",
        "impression_id": "impression:revenue-late",
        "ad_unit_id": "ad-unit-a",
        "ad_network": "synthetic-network",
        "amount_unscaled": "123456789012345678",
        "amount_scale": 18,
        "currency": "EUR",
        "revenue_source": "server_verified"
      },
      "late": true
    }
  ]
}
