{
  "contract_version": "0.2.0",
  "fx_policy": { "policy_version": "fx-v0.1", "target_currency": "USD", "target_scale": 6, "rounding_mode": "half_even", "rates": [{ "currency": "USD", "rate_unscaled": "100000000", "rate_scale": 8, "source": "synthetic-fixture-rate", "as_of": "2026-08-12T00:00:00.000Z" }] },
  "metric_evaluations": [],
  "reconciliation_inputs": [{
    "reconciliation_id": "reconciliation:21", "tenant_id": "tenant-a", "app_id": "app-a",
    "input_snapshot_id": "internal-snapshot:21", "external_snapshot_id": "external-snapshot:21",
    "matching_keys": [{ "type": "provider_install_id", "value": "synthetic-install-21", "scope": "tenant_app", "normalization": "identity", "cardinality": "one_to_one", "protected": true }],
    "candidates": [{ "candidate_id": "install-21", "tenant_id": "tenant-a", "app_id": "app-a", "matching_keys": [{ "type": "provider_install_id", "value": "synthetic-install-21", "scope": "tenant_app", "normalization": "identity", "cardinality": "one_to_one", "protected": true }], "window_status": "out_of_window", "freshness": "current", "excluded": false }],
    "freshness": "current", "privacy_effect": "none"
  }],
  "privacy_requests": [],
  "server_context": { "tenant_id": "tenant-a", "app_id": "app-a", "received_at": "2026-08-12T00:00:00.000Z", "policy_digest": "policy-v0.2", "processing_purposes": [{ "processing_purpose_id": "analytics", "consent_required": false, "policy_version": "consent-v0.2" }], "withdrawals": [], "alternative_legal_bases": [] },
  "records": [{
    "contract_version": "0.2.0", "record_id": "install-21", "delivery_id": "delivery:install-21", "tenant_id": "tenant-a", "app_id": "app-a", "producer": "sdk-android", "producer_version": "fixture-v0.2", "event_id": "event:install-21", "event_name": "install", "schema_version": "0.2.0",
    "occurred_at": "2026-08-12T00:00:00.000Z", "occurred_at_source": "device", "received_at": "2026-08-12T00:00:00.000Z", "processing_purpose_id": "analytics", "processing_sequence": 1,
    "payload": { "installation_id": "installation:install-21", "install_type": "first_install", "referrer_status": "none", "click_id": "click-a_0000000000000021", "install_begin_at_server_status": "missing" }
  }]
}
