{
  "contract_version": "0.2.0",
  "fx_policy": { "policy_version": "fx-v0.1", "target_currency": "USD", "target_scale": 6, "rounding_mode": "half_even", "rates": [{ "currency": "USD", "rate_unscaled": "100000000", "rate_scale": 8, "source": "synthetic-fixture-rate", "as_of": "2026-08-12T00:00:00.000Z" }] },
  "metric_evaluations": [],
  "reconciliation_inputs": [],
  "privacy_requests": [{
    "contract_version": "0.2.0", "tenant_id": "tenant-a", "app_id": "app-a", "privacy_request_id": "privacy-24",
    "deletion_subject_digest": "2424242424242424242424242424242424242424242424242424242424242424",
    "deletion_scope": "installation", "requested_at": "2026-08-12T02:00:00.000Z", "completed_at": "2026-08-12T02:01:00.000Z",
    "status": "completed", "reason_code": "privacy_deletion", "policy_version": "privacy-v0.2",
    "affected_records": [{ "record_id": "click-24", "lifecycle_status": "redacted" }]
  }],
  "server_context": { "tenant_id": "tenant-a", "app_id": "app-a", "received_at": "2026-08-12T01:00:00.000Z", "policy_digest": "policy-v0.2", "processing_purposes": [{ "processing_purpose_id": "analytics", "consent_required": false, "policy_version": "consent-v0.2" }], "withdrawals": [], "alternative_legal_bases": [] },
  "records": [
    {
      "contract_version": "0.2.0", "record_id": "click-24", "delivery_id": "delivery:click-24", "tenant_id": "tenant-a", "app_id": "app-a", "producer": "redirector", "producer_version": "fixture-v0.2", "event_id": "event:click-24", "event_name": "click", "schema_version": "0.2.0",
      "occurred_at": "2026-08-11T00:00:00.000Z", "occurred_at_source": "server", "received_at": "2026-08-11T00:00:00.000Z", "processing_purpose_id": "analytics", "processing_sequence": 1,
      "payload": { "click_id": "click-a_0000000000000024", "tracking_link_id": "link-24", "campaign_id": "campaign-24", "redirector_click_at": "2026-08-11T00:00:00.000Z", "redirector_time_status": "available" }
    },
    {
      "contract_version": "0.2.0", "record_id": "install-24", "delivery_id": "delivery:install-24", "tenant_id": "tenant-a", "app_id": "app-a", "producer": "sdk-android", "producer_version": "fixture-v0.2", "event_id": "event:install-24", "event_name": "install", "schema_version": "0.2.0",
      "occurred_at": "2026-08-12T00:00:00.000Z", "occurred_at_source": "device", "received_at": "2026-08-12T00:00:00.000Z", "processing_purpose_id": "analytics", "processing_sequence": 1,
      "payload": { "installation_id": "installation:install-24", "install_type": "first_install", "referrer_status": "available", "click_id": "click-a_0000000000000024", "install_begin_at_server_status": "available", "install_begin_at_server": "2026-08-12T00:00:00.000Z", "protected_referrer_evidence_ref": "protected:referrer:install-24" }
    }
  ]
}
