{
  "contract_version": "0.2.0",
  "fx_policy": {
    "policy_version": "fx-v0.1",
    "target_currency": "USD",
    "target_scale": 6,
    "rounding_mode": "half_even",
    "rates": [
      {
        "currency": "USD",
        "rate_unscaled": "100000000",
        "rate_scale": 8,
        "source": "synthetic-fixture-rate",
        "as_of": "2026-08-12T00:00:00.000Z"
      }
    ]
  },
  "metric_evaluations": [],
  "reconciliation_inputs": [],
  "privacy_requests": [],
  "server_context": {
    "tenant_id": "tenant-a",
    "app_id": "app-a",
    "received_at": "2026-08-12T00:00:00.000Z",
    "policy_digest": "policy-v0.1",
    "processing_purposes": [
      {
        "processing_purpose_id": "analytics",
        "consent_required": false,
        "policy_version": "consent-v0.1"
      }
    ],
    "withdrawals": [],
    "alternative_legal_bases": []
  },
  "records": [
    {
      "contract_version": "0.2.0",
      "record_id": "click-12",
      "delivery_id": "delivery:click-12",
      "tenant_id": "tenant-a",
      "app_id": "app-a",
      "producer": "redirector",
      "producer_version": "fixture-v0.1",
      "event_id": "event:click-12",
      "event_name": "click",
      "schema_version": "0.2.0",
      "occurred_at": "2026-08-01T00:00:00.000Z",
      "occurred_at_source": "server",
      "received_at": "2026-08-12T00:00:00.000Z",
      "processing_purpose_id": "analytics",
      "processing_sequence": 1,
      "payload": {
        "click_id": "click-a_0000000000000000",
        "tracking_link_id": "link-a",
        "campaign_id": "campaign-a",
        "redirector_click_at": "2026-08-01T00:00:00.000Z",
        "redirector_time_status": "available"
      }
    },
    {
      "contract_version": "0.2.0",
      "record_id": "install-device-cross",
      "delivery_id": "delivery:install-device-cross",
      "tenant_id": "tenant-a",
      "app_id": "app-a",
      "producer": "sdk-android",
      "producer_version": "fixture-v0.1",
      "event_id": "event:install-device-cross",
      "event_name": "install",
      "schema_version": "0.2.0",
      "occurred_at": "2026-08-08T00:00:00.001Z",
      "occurred_at_source": "device",
      "received_at": "2026-08-12T00:00:00.000Z",
      "processing_purpose_id": "analytics",
      "processing_sequence": 1,
      "payload": {
        "installation_id": "installation:install-device-cross",
        "install_type": "first_install",
        "referrer_status": "available",
        "click_id": "click-a_0000000000000000",
        "install_begin_at_server_status": "available",
        "occurred_at_device": "2026-08-08T00:00:00.001Z",
        "install_begin_at_server": "2026-08-07T23:59:59.999Z",
        "protected_referrer_evidence_ref": "protected:referrer:install-device-cross"
      }
    },
    {
      "contract_version": "0.2.0",
      "record_id": "install-missing-authority",
      "delivery_id": "delivery:install-missing-authority",
      "tenant_id": "tenant-a",
      "app_id": "app-a",
      "producer": "sdk-android",
      "producer_version": "fixture-v0.1",
      "event_id": "event:install-missing-authority",
      "event_name": "install",
      "schema_version": "0.2.0",
      "occurred_at": "2026-08-07T00:00:00.000Z",
      "occurred_at_source": "device",
      "received_at": "2026-08-12T00:00:00.000Z",
      "processing_purpose_id": "analytics",
      "processing_sequence": 1,
      "payload": {
        "installation_id": "installation:install-missing-authority",
        "install_type": "first_install",
        "referrer_status": "available",
        "click_id": "click-a_0000000000000000",
        "install_begin_at_server_status": "missing",
        "protected_referrer_evidence_ref": "protected:referrer:install-missing-authority"
      }
    },
    {
      "contract_version": "0.2.0",
      "record_id": "install-invalid-authority",
      "delivery_id": "delivery:install-invalid-authority",
      "tenant_id": "tenant-a",
      "app_id": "app-a",
      "producer": "sdk-android",
      "producer_version": "fixture-v0.1",
      "event_id": "event:install-invalid-authority",
      "event_name": "install",
      "schema_version": "0.2.0",
      "occurred_at": "2026-08-07T00:00:00.000Z",
      "occurred_at_source": "device",
      "received_at": "2026-08-12T00:00:00.000Z",
      "processing_purpose_id": "analytics",
      "processing_sequence": 1,
      "payload": {
        "installation_id": "installation:install-invalid-authority",
        "install_type": "first_install",
        "referrer_status": "available",
        "click_id": "click-a_0000000000000000",
        "install_begin_at_server_status": "invalid",
        "protected_referrer_evidence_ref": "protected:referrer:install-invalid-authority"
      }
    }
  ]
}
