{
  "contract_version": "0.2.0",
  "fx_policy": {
    "policy_version": "fx-v0.1",
    "target_currency": "USD",
    "target_scale": 6,
    "rounding_mode": "half_even",
    "rates": [
      {
        "currency": "USD",
        "rate_unscaled": "100000000",
        "rate_scale": 8,
        "source": "synthetic-fixture-rate",
        "as_of": "2026-08-12T00:00:00.000Z"
      }
    ]
  },
  "metric_evaluations": [],
  "reconciliation_inputs": [
    {
      "reconciliation_id": "reconciliation:01",
      "tenant_id": "tenant-a",
      "app_id": "app-a",
      "input_snapshot_id": "internal-snapshot:01",
      "external_snapshot_id": "external-snapshot:01",
      "matching_keys": [
        {
          "type": "provider_install_id",
          "value": "synthetic-install-1",
          "scope": "tenant_app",
          "normalization": "identity",
          "cardinality": "one_to_one",
          "protected": true
        }
      ],
      "candidates": [
        {
          "candidate_id": "install-1",
          "tenant_id": "tenant-a",
          "app_id": "app-a",
          "matching_keys": [
            {
              "type": "provider_install_id",
              "value": "synthetic-install-1",
              "scope": "tenant_app",
              "normalization": "identity",
              "cardinality": "one_to_one",
              "protected": true
            }
          ],
          "window_status": "in_window",
          "freshness": "current",
          "excluded": false
        }
      ],
      "freshness": "current",
      "privacy_effect": "none"
    }
  ],
  "privacy_requests": [],
  "server_context": {
    "tenant_id": "tenant-a",
    "app_id": "app-a",
    "received_at": "2026-08-12T00:00:00.000Z",
    "policy_digest": "policy-v0.1",
    "processing_purposes": [
      {
        "processing_purpose_id": "analytics",
        "consent_required": false,
        "policy_version": "consent-v0.1"
      }
    ],
    "withdrawals": [],
    "alternative_legal_bases": []
  },
  "records": [
    {
      "contract_version": "0.2.0",
      "record_id": "click-1",
      "delivery_id": "delivery:click-1",
      "tenant_id": "tenant-a",
      "app_id": "app-a",
      "producer": "redirector",
      "producer_version": "fixture-v0.1",
      "event_id": "event:click-1",
      "event_name": "click",
      "schema_version": "0.2.0",
      "occurred_at": "2026-08-05T00:00:00.000Z",
      "occurred_at_source": "server",
      "received_at": "2026-08-12T00:00:00.000Z",
      "processing_purpose_id": "analytics",
      "processing_sequence": 1,
      "payload": {
        "click_id": "click-a",
        "tracking_link_id": "link-a",
        "campaign_id": "campaign-a",
        "redirector_click_at": "2026-08-05T00:00:00.000Z",
        "redirector_time_status": "available"
      }
    },
    {
      "contract_version": "0.2.0",
      "record_id": "install-1",
      "delivery_id": "delivery:install-1",
      "tenant_id": "tenant-a",
      "app_id": "app-a",
      "producer": "sdk-android",
      "producer_version": "fixture-v0.1",
      "event_id": "event:install-1",
      "event_name": "install",
      "schema_version": "0.2.0",
      "occurred_at": "2026-08-06T00:00:00.000Z",
      "occurred_at_source": "device",
      "received_at": "2026-08-12T00:00:00.000Z",
      "processing_purpose_id": "analytics",
      "processing_sequence": 1,
      "payload": {
        "installation_id": "installation:install-1",
        "install_type": "first_install",
        "referrer_status": "available",
        "click_id": "click-a",
        "install_begin_at_server_status": "available",
        "install_begin_at_server": "2026-08-06T00:00:00.000Z",
        "protected_referrer_evidence_ref": "protected:referrer:install-1"
      }
    }
  ]
}
