{
  "contract_version": "0.2.0",
  "fx_policy": {
    "policy_version": "fx-v0.1",
    "target_currency": "USD",
    "target_scale": 6,
    "rounding_mode": "half_even",
    "rates": [
      {
        "currency": "USD",
        "rate_unscaled": "100000000",
        "rate_scale": 8,
        "source": "synthetic-fixture-rate",
        "as_of": "2026-08-12T00:00:00.000Z"
      }
    ]
  },
  "metric_evaluations": [],
  "reconciliation_inputs": [],
  "privacy_requests": [],
  "server_context": {
    "tenant_id": "tenant-a",
    "app_id": "app-a",
    "received_at": "2026-08-12T00:00:00.000Z",
    "policy_digest": "policy-v0.1",
    "processing_purposes": [
      {
        "processing_purpose_id": "analytics",
        "consent_required": false,
        "policy_version": "consent-v0.1"
      }
    ],
    "withdrawals": [],
    "alternative_legal_bases": []
  },
  "records": [
    {
      "contract_version": "0.2.0",
      "record_id": "install-2",
      "delivery_id": "delivery:install-2",
      "tenant_id": "tenant-a",
      "app_id": "app-a",
      "producer": "sdk-android",
      "producer_version": "fixture-v0.1",
      "event_id": "event:install-2",
      "event_name": "install",
      "schema_version": "0.2.0",
      "occurred_at": "2026-08-12T00:00:00.000Z",
      "occurred_at_source": "device",
      "received_at": "2026-08-12T00:00:00.000Z",
      "processing_purpose_id": "analytics",
      "processing_sequence": 1,
      "payload": {
        "installation_id": "installation:install-2",
        "install_type": "first_install",
        "referrer_status": "none",
        "click_id": "click-a",
        "install_begin_at_server_status": "missing"
      }
    }
  ]
}
