{
  "contract_version": "0.2.0",
  "fx_policy": {
    "policy_version": "fx-v0.1",
    "target_currency": "USD",
    "target_scale": 6,
    "rounding_mode": "half_even",
    "rates": [
      {
        "currency": "USD",
        "rate_unscaled": "100000000",
        "rate_scale": 8,
        "source": "synthetic-fixture-rate",
        "as_of": "2026-08-12T00:00:00.000Z"
      }
    ]
  },
  "metric_evaluations": [],
  "reconciliation_inputs": [],
  "privacy_requests": [],
  "batches": [
    {
      "batch_id": "tenant-a-batch",
      "server_context": {
        "tenant_id": "tenant-a",
        "app_id": "app-a",
        "received_at": "2026-08-12T00:00:00.000Z",
        "policy_digest": "policy-v0.1",
        "processing_purposes": [
          {
            "processing_purpose_id": "analytics",
            "consent_required": false,
            "policy_version": "consent-v0.1"
          }
        ],
        "withdrawals": [],
        "alternative_legal_bases": []
      },
      "records": [
        {
          "contract_version": "0.2.0",
          "record_id": "tenant-a-record",
          "delivery_id": "delivery:tenant-a-record",
          "tenant_id": "tenant-a",
          "app_id": "app-a",
          "producer": "redirector",
          "producer_version": "fixture-v0.1",
          "event_id": "shared-event-id",
          "event_name": "click",
          "schema_version": "0.2.0",
          "occurred_at": "2026-08-10T00:00:00.000Z",
          "occurred_at_source": "server",
          "received_at": "2026-08-12T00:00:00.000Z",
          "processing_purpose_id": "analytics",
          "processing_sequence": 1,
          "payload": {
            "click_id": "click-a",
            "tracking_link_id": "link-a",
            "campaign_id": "campaign-a",
            "redirector_click_at": "2026-08-10T00:00:00.000Z",
            "redirector_time_status": "available"
          }
        }
      ]
    },
    {
      "batch_id": "tenant-b-batch",
      "server_context": {
        "tenant_id": "tenant-b",
        "app_id": "app-b",
        "received_at": "2026-08-12T00:00:00.000Z",
        "policy_digest": "policy-v0.1",
        "processing_purposes": [
          {
            "processing_purpose_id": "analytics",
            "consent_required": false,
            "policy_version": "consent-v0.1"
          }
        ],
        "withdrawals": [],
        "alternative_legal_bases": []
      },
      "records": [
        {
          "contract_version": "0.2.0",
          "record_id": "tenant-b-record",
          "delivery_id": "delivery:tenant-b-record",
          "tenant_id": "tenant-b",
          "app_id": "app-b",
          "producer": "redirector",
          "producer_version": "fixture-v0.1",
          "event_id": "shared-event-id",
          "event_name": "click",
          "schema_version": "0.2.0",
          "occurred_at": "2026-08-10T00:00:00.000Z",
          "occurred_at_source": "server",
          "received_at": "2026-08-12T00:00:00.000Z",
          "processing_purpose_id": "analytics",
          "processing_sequence": 1,
          "payload": {
            "click_id": "click-a",
            "tracking_link_id": "link-a",
            "campaign_id": "campaign-a",
            "redirector_click_at": "2026-08-10T00:00:00.000Z",
            "redirector_time_status": "available"
          }
        }
      ]
    },
    {
      "batch_id": "mismatch-batch",
      "server_context": {
        "tenant_id": "tenant-a",
        "app_id": "app-a",
        "received_at": "2026-08-12T00:00:00.000Z",
        "policy_digest": "policy-v0.1",
        "processing_purposes": [
          {
            "processing_purpose_id": "analytics",
            "consent_required": false,
            "policy_version": "consent-v0.1"
          }
        ],
        "withdrawals": [],
        "alternative_legal_bases": []
      },
      "records": [
        {
          "contract_version": "0.2.0",
          "record_id": "tenant-mismatch",
          "delivery_id": "delivery:tenant-mismatch",
          "tenant_id": "tenant-b",
          "app_id": "app-a",
          "producer": "redirector",
          "producer_version": "fixture-v0.1",
          "event_id": "event:tenant-mismatch",
          "event_name": "click",
          "schema_version": "0.2.0",
          "occurred_at": "2026-08-10T00:00:00.000Z",
          "occurred_at_source": "server",
          "received_at": "2026-08-12T00:00:00.000Z",
          "processing_purpose_id": "analytics",
          "processing_sequence": 1,
          "payload": {
            "click_id": "click-a",
            "tracking_link_id": "link-a",
            "campaign_id": "campaign-a",
            "redirector_click_at": "2026-08-10T00:00:00.000Z",
            "redirector_time_status": "available"
          }
        }
      ]
    }
  ]
}
