{
  "contract_version": "0.2.0",
  "fx_policy": {
    "policy_version": "fx-v0.1",
    "target_currency": "USD",
    "target_scale": 6,
    "rounding_mode": "half_even",
    "rates": [
      {
        "currency": "USD",
        "rate_unscaled": "100000000",
        "rate_scale": 8,
        "source": "synthetic-fixture-rate",
        "as_of": "2026-08-12T00:00:00.000Z"
      }
    ]
  },
  "metric_evaluations": [
    {
      "metric_run_id_prefix": "run-17-before",
      "input_received_at_watermark": "2026-08-12T01:01:00.000Z",
      "computed_at": "2026-08-12T01:02:00.000Z",
      "data_freshness": "complete",
      "privacy_state": "before"
    },
    {
      "metric_run_id_prefix": "run-17-after",
      "input_received_at_watermark": "2026-08-12T01:01:00.000Z",
      "computed_at": "2026-08-12T02:01:00.000Z",
      "data_freshness": "recalculated",
      "privacy_state": "after",
      "supersedes_metric_run_id_prefix": "run-17-before"
    }
  ],
  "reconciliation_inputs": [
    {
      "reconciliation_id": "reconciliation:17",
      "tenant_id": "tenant-a",
      "app_id": "app-a",
      "input_snapshot_id": "internal-snapshot:17",
      "external_snapshot_id": "external-snapshot:17",
      "matching_keys": [],
      "candidates": [],
      "freshness": "recalculated",
      "privacy_effect": "redaction"
    }
  ],
  "privacy_requests": [
    {
      "contract_version": "0.2.0",
      "tenant_id": "tenant-a",
      "app_id": "app-a",
      "privacy_request_id": "privacy-17",
      "deletion_subject_digest": "1111111111111111111111111111111111111111111111111111111111111111",
      "deletion_scope": "installation",
      "requested_at": "2026-08-12T01:30:00.000Z",
      "completed_at": "2026-08-12T02:00:00.000Z",
      "status": "completed",
      "reason_code": "privacy_deletion",
      "policy_version": "privacy-v1",
      "affected_records": [
        {
          "record_id": "revenue-17",
          "lifecycle_status": "redacted"
        },
        {
          "record_id": "session-purge-17",
          "lifecycle_status": "purged"
        }
      ]
    }
  ],
  "server_context": {
    "tenant_id": "tenant-a",
    "app_id": "app-a",
    "received_at": "2026-08-12T00:00:00.000Z",
    "policy_digest": "policy-v0.1",
    "processing_purposes": [
      {
        "processing_purpose_id": "analytics",
        "consent_required": false,
        "policy_version": "consent-v0.1"
      }
    ],
    "withdrawals": [],
    "alternative_legal_bases": []
  },
  "records": [
    {
      "contract_version": "0.2.0",
      "record_id": "install-17",
      "delivery_id": "delivery:install-17",
      "tenant_id": "tenant-a",
      "app_id": "app-a",
      "producer": "sdk-android",
      "producer_version": "fixture-v0.1",
      "event_id": "event:install-17",
      "event_name": "install",
      "schema_version": "0.2.0",
      "occurred_at": "2026-08-12T00:00:00.000Z",
      "occurred_at_source": "device",
      "received_at": "2026-08-12T00:01:00.000Z",
      "processing_purpose_id": "analytics",
      "processing_sequence": 1,
      "payload": {
        "installation_id": "installation:install-17",
        "install_type": "first_install",
        "referrer_status": "none",
        "click_id": "click-a_0000000000000000",
        "install_begin_at_server_status": "missing"
      }
    },
    {
      "contract_version": "0.2.0",
      "record_id": "revenue-17",
      "delivery_id": "delivery:revenue-17",
      "tenant_id": "tenant-a",
      "app_id": "app-a",
      "producer": "sdk-android",
      "producer_version": "fixture-v0.1",
      "event_id": "event:revenue-17",
      "event_name": "ad_revenue",
      "schema_version": "0.2.0",
      "occurred_at": "2026-08-12T01:00:00.000Z",
      "occurred_at_source": "device",
      "received_at": "2026-08-12T01:01:00.000Z",
      "processing_purpose_id": "analytics",
      "processing_sequence": 1,
      "payload": {
        "installation_id": "installation:install-17",
        "impression_id": "impression:revenue-17",
        "ad_unit_id": "ad-unit-a",
        "ad_network": "synthetic-network",
        "amount_unscaled": "1000000",
        "amount_scale": 6,
        "currency": "USD",
        "revenue_source": "server_verified"
      }
    },
    {
      "contract_version": "0.2.0",
      "record_id": "session-purge-17",
      "delivery_id": "delivery:session-purge-17",
      "tenant_id": "tenant-a",
      "app_id": "app-a",
      "producer": "sdk-android",
      "producer_version": "fixture-v0.1",
      "event_id": "event:session-purge-17",
      "event_name": "session_start",
      "schema_version": "0.2.0",
      "occurred_at": "2026-08-12T00:30:00.000Z",
      "occurred_at_source": "device",
      "received_at": "2026-08-12T00:31:00.000Z",
      "processing_purpose_id": "analytics",
      "processing_sequence": 1,
      "payload": {
        "installation_id": "installation:install-17",
        "session_id": "session-purge"
      }
    }
  ]
}
